,url,content,category,published_date
24,https://english.onlinekhabar.com/austrian-climber-who-visited-nepal-100-times-in-50-yrs-mountains-teach-coming-down-is-as-important-as-going-up.html,"
Wolfgang Nairz is a renowned mountaineer and the leader of Austria’s 1978 Everest expedition, in which Reinhold Messner and Peter Habeler reached the top of Everest without bottled oxygen.
Nairz first came to Nepal in 1970 and since then has been coming to Nepal on a regular basis. Last week, Nairz arrived in Nepal for the 100th time, becoming probably the first foreigner to do so. Upon arrival, his hosts and fans gave him a ‘hero’s welcome’ at the Kathmandu airport and took him to Thamel on a traditional carriage (baggi). Later, Nairz spoke to Onlinekhabar about his impression of Nepal, how things have changed here and about his projects in the country. Excerpts: 
How does it feel to come to Nepal for the 100th time? 
It doesn’t feel any different actually. It feels like coming back home. It has nearly been 50 years since I came to Nepal for the first time, but the joy I get coming to this country is the same. Initially, I was interested in the mountains, but now I also come for the culture and the people. We have a lot of projects here.
What brings you back every time? 
Well, it has to be people. Over the past 50 years, I’ve met a lot of good people. Along with the people, I’d also say the landscape and the culture and religion. I’d say a harmony between the three.
You came to Thamel riding on a carriage all the way from the airport. How was that feeling?
Incredible. I have some great friends here who have given me a terrific reception on my 100th visit to Nepal. They had told me they were not there, but then everyone was at the airport. It was a great surprise, the one I will never forget. The streets were clean, flowers everywhere. It’s like they had done it not for the Chinese President, but for me.
Nairz riding towards Marsyandi Hotel in Thamel on a carriage arranged for him by his friends.
How have things changed since you first came to now?
A lot has changed. I don’t think you can even imagine how things were during those times. There were only three or four big hotels; others were only small guest houses. We rode only bicycles as there were hardly any cars on the roads. We used to go to Bouddha, Patan and other areas on our bicycles. It was really a different time.
Kathmandu has changed the most. It was much calmer. Now it’s a bit wild. I remember we had to carry our own bags off the plane before going to the immigration office. I’d say the change in Kathmandu is negative. However, the changes in the remote areas have been positive. I think that is all thanks to tourism. It’s helped develop areas like Namche into something better.
How would you describe your Everest expedition in 1978?
I’d say it was difficult. Things are a lot easy now. Back then we had to do a lot of work. When I reached the top of Everest, only 60 climbers had reached the top so you could imagine how tough it was. But we had a good team which had Reinhold Messner among others and I think we did a fairly good job. We had no icefall doctors so we had to fix ropes and also prepare camps. It was not as easy as people have it now. We also did not have communication with the outside world. Any source of communication had to come through Kathmandu first, then fly to Lukla and then to base camp.
Was there pressure to summit Everest? 
There wasn’t actually. We were quite calm. Yes, we did have our fair share of luck thanks to the good weather, but we were good climbers. We knew we had it in us to get to the top of the world’s highest peak. Our Sherpas were quite good too.
What other mountains have you climbed here? 
I’ve been to seven 8,000-metre peaks here in Nepal and led the expedition in all of them. I’ve climbed Manaslu South Face in 1972, which was my first, then Makalu South Face in 1974, Everest in 1978, Ama Dablam in 1979 where we rescued Sir Edmund Hillary’s son. I also summited Dhaulagiri, Cho Oyu South Face.
What have these mountains taught you? 
Well the one lesson that the mountains have given me is that there’s always the next time. It’s taught me that coming back down is as important as going up. I lost a friend during the Dhaulagiri expedition which still hurts me. It’s taught me that every mountain is different and each should be respected individually.
What do you do when you come to Nepal every year? 
The first thing I do is meeting my friends. After that, I go to monitor various projects which I’m funding. We’ve been doing a lot of charity work here, especially after the 2015 earthquake. We’re working on the Hillary Hospital to which my and Messner’s foundation has donated around $400,000. We’re working with Tashi Tenzing and Green Tara Foundation building schools. I also have a Sherpa Project where I take 25 Nepalis from remote areas to Austria and give them lodge management training.
This is a win-win situation for both the lodge owner in Austria who gets human resources and to Nepalis here who can learn a lot by spending three to four months in Austria. They also get a good salary there.
We’re also building schools here. One in Sindupalchok for around 200 children with Tashi Tenzing. In Chilaune of the district, we’ve built another school. We’re also working on a reforestation project in the Khumbu region. We’ve also help build a few cultural monuments in the region so people can go practice their faith there.
Wolfgang with his wife Edith
How do you raise money for these projects? 
Well, my organisation has over 150 members and we do various fundraising activities. We give lectures, attend various programmes which help us get money. If you look at the things post-earthquake, we’ve nearly spent $700,000 rebuilding schools and hospitals in the remotest parts of Nepal.
So your charity only involves Nepal? 
Yes. Just here.
What about your partners here? 
They have been important to me. Sonam Sherpa, Tsering Lama, Tashi Tenzing, Ang Rita all have been great. I can trust these people wholeheartedly. They know where help is required and through them I can send funds there. I know that the money we’re raising is going to good hands. Corruption is quite high here in Nepal, which is why we need people like them.
How often do you travel around here? 
I travel a lot. How do you think I reach 100? I love to trek around. I’ve been to some really good places. Upper Dolpo, Mustang, Nar Phu… these places aren’t visited by many. I bring friends with me most of the time and we go trekking. This year, we’re going to Langtang.
Do you think tourism has got better here?
I think it has, but there is a lot more we need to do to make sure that Visit Nepal 2020 is a success. They have increased visa fees. They take so much money for permits, but where is the money? People need to ask the government what they’re doing with the money coming in from tourists. It needs to be addressed. The private sector is doing well when it comes to tourism. However, I don’t see the government is doing enough.
Photos: Shreedhar Poudel",/interview,"Mon, 14 Oct 2019 05:09:01 +0000"
25,https://english.onlinekhabar.com/everest-climb-in-autumn-sounds-tough-but-can-be-done-garrett-madison.html,"
Garrett Madison is one of the most sought-after foreign climbers and mountain guides. Since he first summited Everest in 2006, he has led over 60 climbers to the summit of Everest and started his own company, Madison Mountaineering.
Madison holds multiple high-altitude mountaineering world records. He is the only person to have climbed Mount Everest and Lhotse in a day, that too three times. He is also the only American to have climbed K2 twice. Madison spoke to Onlinekhabar about his current expedition where he plans to take a team to the top of Everest in autumn for the first time since 2010 and about mountaineering in Nepal. Excerpts:
How did you go from being a mountain guide to starting your own company? 
I started working as a mountain guide in 1999 when I was 20. It was a summer job to guide people up Mount Rainer. That is how I started. As I loved mountaineering, I joined Alpine Accents International and worked for them until 2014 when I thought why not start my own company. That’s how Madison Mountaineering started. My maiden project was to lead the climb on Everest in 2014 and it’s been a fun but a challenging adventure ever since.
How different was running your own company from working for an expedition company? 
It’s basically the same stuff that I do now. It is just a bit more responsibility on the logistic side. But I have a good team that handles it. So I’d say I’m lucky in that regard.
You recently climbed Everest in the spring season, what made you come back in the autumn? 
I’ve never climbed Everest in autumn. However, I have attempted other 8,000 metre peaks such as Manaslu, Makalu and Cho Oyu in autumn. But I wanted to do Everest too. The main reason is that we’re doing Everest this year because Mountain Hardware, which makes clothing equipment for high altitude climbing wanted to test its new product line. We felt that the best place and time to test it was on Everest in the autumn. We’ll be testing everything from down suits to sleeping bags to tents.
Apart from that, we at Madison Mountaineering wanted to do something unique. As the spring season is overcrowded, we wanted to see if we can market Everest for the autumn. That would help minimise the crowd during the spring. Everest hasn’t been summited in autumn since 2010 and we want to see if we can change that. We have some good climbers on the mountain like Kilian Jornet and Andrzej Bargiel so hopefully, we can work together to reach the top. Our Nepali climbers are just as good and are currently fixing ropes and arranging the base camp so we’re positive about this expedition.
But I am concerned that it’s been raining so much. Rain here means a lot of snow in the mountains and that means there’s a risk of avalanches.
How different do you expect that mountain to be in autumn as compared to spring? 
Well, post-monsoon is different for a variety of reason. Firstly, there’s is a lot of snow up there. Secondly, there are a lot fewer people on the mountain. In spring, there are around a 400-500 people on the mountain, but now there’s going to be around 10-15 max. Autumn is also more winter-like. With winter around the corner days will be shorter and will be windier. The summit weather window will also be shorter. Will be a lot challenging. I’ve done Everest 10 times all in the spring so if we can prove that Everest can be done in the autumn that would be great.
How’s rope fixing going on amidst the rain? 
It’s going on at a slow pace. The weather isn’t good and the Nepali climbers have told me that it’s very cloudy up there. They are one-quarter of the way up the Khumbu icefall. They’re hoping they’ll reach Camp 1 in a week’s time. Our plan is to reach base camp by mid-September and hope by then they’ll be able to reach Camp 2.
Your success rate is quite high. What, according to you, makes a good mountain guide? 
I’d say lots of experience and willingness to learn from mistakes and surrounding yourself with good people. You’ll also need some natural ability and some physical fitness to function well in the death zones. Apart from that we also need proper mountain training and techniques. It’s a combination of knowledge and skill I would say.
Madison on the summit of Everest.
People often say that climbing in Europe and the Americas is different from climbing in the Himalayas. How true is that? 
It’s very true.  In America and the Alps, it’s more like one-day climbs. You start from a mountain hut and climb for one day and your back. You’re just out for a day or maybe half a day. But here you’re up for two weeks. It’s a real expedition here. Have to carry a lot of stuff to be self-sufficient like medical kits, food and a lot more. There is also no quick evacuation. In the Alps, you get a helicopter rescue at any point, but you don’t get that luxury here in the Himalayas.
What do you feel is the toughest part of being a mountaineer?
I guess it’s the sacrifices you have to make. Spending all this time away from family and loved ones isn’t easy. It’s not like a normal job where you leave home and come back in the evening every day. I’m out for two-three months at a time, and spend around 10 months on the road in a year. So I’d that that is the toughest part.
Do clients appreciate your effort when you take them to the top?
They do. I feel happy when they do. But there are times when I cannot fulfil their expectations and they’re not happy. But I try to tell them that their life is much important that the summit. I don’t like risking people’s lives. My first priority is to make sure everyone comes back safe, this includes the Nepali climbers we have on our team.
Do you enjoy climbing mountains? Here the people from Khumbu climb because they don’t have a choice. They say it’s not fun. Do you have fun? 
Yes, I love climbing. This is my passion. When I was a young man and climbed my first mountain I didn’t want to look back. In the US it’s not a lucrative profession, but I didn’t care about it. Because when you do something you love, you don’t feel like its work. I love the challenge too. Made a lot of memories climbing and will continue to do so.
How satisfied do you get when to take clients up to the summit? 
It’s very satisfying as you’ve helped them reach their goal and also helped changed them in a positive way. What I like is how people get new experiences in a foreign land. They tell me they learn a lot about the country as they spend from a few weeks to a few months depending on where they are. They also make friends and take back more than just a climbing certificate.
What do you love the most about the mountains? 
Just being out there in nature with similar-minded people. We share the same passion and enthusiasm. It’s just the best thing.
When we talk about Everest, we have to talk about the traffic jam picture. For someone who was there, how bad was it? 
Well, it wasn’t as bad as the photograph. It was a busy day but it wasn’t the busiest day I’ve seen on Everest. The reason why it looked so crowded was that there were 200 people queuing up to reach the summit. If you have 100 people going up and another 100 people coming down there is sure to be a traffic jam. That’s when the photo was taken. But the media thinks that it is like that all the time which it’s not. It was maybe one hour, one day, in one year. Feel it was blown out of proportion.
Would you blame the traffic jam for all the deaths? 
I don’t think I would. The lives lost in Everest this year could have been saved with good planning and good managing. There are two types of expeditions on Everest. There is a guided expedition like mine where they hire someone like me and my company to manage logistics and in the long run take them to the summit and also make decisions for them.
And then there is the other type of expedition is when a company just manages the climber’s logistics like permits, oxygen, porters and food. But in these expeditions, the climber makes his own decisions.  The company doesn’t tell them to turn around if they can’t climb. That is when people die. Because when you’re up there you can’t think straight. And if you’re not experienced that can cause a lot more problem.
Those that died this year didn’t have experience climbing such a tough mountain.

Will the government’s plan to make it mandatory to climb a mountain in Nepal before attempting Everest prevent these deaths?
I don’t think it’s a bad idea to try to ensure that Everest climbers are more qualified. However, with this rule, if a climber has climbed K2, he/she would still be ineligible to climb Everest which is wrong in my opinion. It doesn’t make sense to me.
How has mountaineering changed in Nepal since you first came here in 2006?
For starters, there are a lot more people in the sport. I feel the sport has grown for several reason. People want to go to these iconic places like the top of Everest. And now that’s it’s possible for more people, the mountain has seen a lot of people since I first climbed in 2006.
Is the rapid growth in Nepali expedition companies the reason why the number of people climbing Everest as risen significantly? 
These new Nepali companies are simply offering a product that has a demand in the market. The climbers want this product. They want to be able to come and climb Everest at a cheaper price. Some people feel they don’t want a guy like me making decisions on their behalf. They want to make their own decisions. The clients are demanding this service and the companies we see now are just fulfilling their demands.
But is that the reason the mountains are getting inexperienced climbers which causes deaths on these 8000 m peaks?
The business model for Nepali companies is different from mine. I make sure that I have experienced climbers on my team and try to keep my team small up to 12 members. The team has high-level support as we have both high-level mountain guides and experienced Nepali high altitude climbers. Along with that we also have top equipment and ample supply of oxygen. I try to offer and run a good program on the mountain.
But the Nepali companies’ model is different. They believe in volume. They offer a similar programme for a much lower cost. Per person, there is a much smaller profit margin, but if you’re able to bring in numbers, you’re definitely going to make money. So their product is volume-based and it’s not a guided trip. The climber makes his/her own decision. The companies provide just logistics and service to climb the mountain, but there’s no one telling them if it’s safe to go up. Well, they have Nepali high altitude climbers but they can’t tell their clients not to go up and it’s dangerous.
The fatalities are that of climbers who don’t have experience and really want to go to the top of a mountain. The people compare prices and always choose a Nepali company as its half cheaper than companies like mine charge. These people don’t have anyone to ask if it’s worth the risk. Most push themselves which makes it tough on their body and collapse.
What makes you different from these other companies?
My risk tolerance is lower than theirs. They tend to think they can do anything, whereas I feel that I can’t. It’s because I am liable for the safety of my clients which is of paramount importance. I need to take that into consideration before making a risky decision. It a fundamental difference of approach. Some of my clients get really irked when people from other expedition agencies summit and we don’t. It happened this year in K2 when we came back because it was not worth the risk. But one client was not happy that we didn’t summit and other teams did. It is hard to explain to people like him that it’s not worth it. But hey, they pay a lot of money so they are right to think that way I guess.
Photos: Garrett Madison/Madison Mountaineering",/interview,"Sun, 08 Sep 2019 05:43:50 +0000"
26,https://english.onlinekhabar.com/daraz-ceo-need-to-localise-if-we-want-to-achieve-success-in-nepal.html,"
Bjarke Mikkelsen is the co-CEO of Daraz Group, a popular online shopping company of the region. He has been with the company for the past four years. Prior to joining Daraz, Mikkelsen worked at Goldman Sachs where he worked as its Executive Director for its branch in London.
Mikkelsen spoke to Onlinekhabar about how his company has changed after being acquired by Alibaba and why localising strategies here in Nepal was important for them to grow as a business. Excerpts:
What has changed since Alibaba acquired Daraz?
Three things have changed mainly. First is the technology. Our value proposition to the customer has improved significantly as we are providing a lot more services. For example, we have started the instant messaging service which allows customers and sellers to communicate with one another in a regulated way. It has opened a world of opportunities. The way we display relevant product to relevant customers at the right time is also a huge improvement we’ve made in recent times.
Number two is the supply change. It has increased substantially as now we are working with sellers around the world and also opening up to Nepali sellers to sell to consumers around the world. This is something we’re working on as a big project with Alibaba to integrate all of their different marketplace platforms. We’re also working on a project which will allow a Nepali seller sign up on Daraz and then automatically be eligible to sell to China or anywhere around the world through one single account.
Number three is just learning. So far, we have been figuring out all on our own, but now that we are affiliated with Alibaba we can do things a lot more efficiently because what we are doing here now, they did it in China years ago.
When can people buy items from Alibaba here in Nepal?
You already can, to some extent. We have a global collection in the app through which you can directly order stuff from China.  Slowly, we will be doing more in that aspect.
Why did 11:11 fail in Nepal as compared to other markets?
In general, that was a new concept here in Nepal and we got to learn a lot from it. Alibaba’s 11:11 is the biggest shopping date worldwide and we wanted to try it here too. From a sales perspective, I don’t think it failed. The sales volume was higher than what we expected. But we had these learnings.
We found after the event the certain customers had to wait longer for the items they had ordered. But considering the order volume that we had, we actually enforced a lot after this campaign. We focused a lot on logistics infrastructure.
Since then, we have also been evaluating the performance of every seller. We do not want our customers to suffer. We sit with them and bring out solutions to make them better.
After 11:11, we also launched a campaign in Nepali New Year, and it was good. We have delivered items in a better manner during that campaign than we do on normal days. Be rest assured, 11:11 will be better this year.
How is Alibaba’s model in South Asia different from that of other countries?
I think it’s a lot more localised. What we’re doing now is trying to understand how the local sellers work and what services do they need. Because the services here may be different from, for example, the services they need in China and Malaysia where everything is digitised and integrated.
It is the same principle which is mainly about being engaged and having something for everyone and using technology to manage a huge marketplace with a lot of sellers and a lot of customers.

Is the app also localised?
It is. The algorithm, mainly, is. We look at what people are searching for and what do they want to see and we try to give them that experience. We also try doing local campaigns which aren’t happening in other countries. We did Nepali New Year earlier this year and now we are doing one for Dashain which starts on September 15.
Have you achieved the breakeven? 
No. Not yet. But we will do that. We plan to be a profitable company by 2022. So far we are still investing in the country. We need to build the infrastructure and we need to have the scale.
Kyamu, when it came to Nepal, advertised on Facebook and Google. That has now changed as you have been advertising in the mainstream media. What brought about this change? 
Advertising, in general, has changed since Kyamu was here and we just evolved with it. The manner in which Nepalis interact with media and the internet has also changed. That way we also learned year on year on what was better for our business. As for our advertising strategy, it didn’t change after we rebranded as Daraz or after Alibaba’s acquisition. When we came here with Kyamu, we came in as a startup, but now we are an established business. In general, our strategy is to stay current and relevant which is why we have been working with more influencers than before.
What inspired Daraz University? How have sellers here taken to it?
It was inspired by Taobao University in China started by Alibaba. When we first started working with Alibaba who had a gigantic university in China we wanted to do something similar to give sellers the knowhow to sell. That was the inspiration. After that, we sat down with a blank piece of paper and started to design a curriculum and we started to do it. That way anyone who has a smartphone can start his/her business.",/interview,"Wed, 28 Aug 2019 08:36:34 +0000"
