,url,content,category,published_date
30,https://english.onlinekhabar.com/kokroma-blending-the-uniqueness-of-nepali-bhoto-with-european-business-tricks.html,"A child wears Kokroma daura-suruwal.
Rewati Gurung was well-exposed to the western world during her formative years. She studied English literature in her master’s first and moved to development studies–both courses were dominated by theories and examples from America and Europe. Consequently, her brain was programmed to think that foreigners, whites in particular, were better than Nepalis.
In 2015, Gurung attended a summer school in Finland, during which she learned about the impacts of ‘Finnish Baby Box‘, a cradle along with a package of clothes uniquely designed for newly born infants and their moms after World War II. Three years later, she ordered one such box to be delivered to her in Kathmandu, all the way from Helsinki. Having seen some women-led enterprises in Nepal, Gurung was thinking if any Nepali woman could replicate the Finnish model. It was a part of her personal research.
Gurung’s ‘colonised’ brain was expecting some ‘scientifically-designed’ and ‘real European’ items in the box. “But, I was shocked…,” when the filmmaker-cum-enterprises narrates it after nearly two years, the ‘shock’ is reflected on her face again, “… because that box had something exactly like our bhoto.” [Bhoto is a typically-designed homemade vest for children in Nepal.]
That ‘Finnish bhoto’ brought a paradigm shift in her mind. At first, it compelled her to research why Nepali and Finnish societies have the same kinds of apparel for babies. After completing the research, she decided that she would follow, not replicate, the business model and design a ‘Nepali’ baby box instead. Once the white-is-better thinker, Gurung today owns a startup named Kokroma that manufactures and sells Nepali-design baby clothes.
The science of Nepali baby garments

The findings of Gurung’s informal research were interesting. She got answers to the questions like why a bhoto usually has an inner layer (bhitri), why it has laces (tunas) instead of buttons, and why they fill pillows with mustard seeds.
“From old grannies in my extended family and neighbourhood, I learned that the inner layer of your bhoto has two functions: it absorbs sweat, and it protects the baby’s soft skin from the less soft outer,” she elaborates, “Likewise, the laces were scientific because the kids could swallow buttons.”
She also learned that the Nepali society preferred pure cotton for baby clothing “because it is a natural fibre; it does not cause any harm even if the baby chews and swallows it.” Similarly, mustard seeds are filled in the pillows because they help the baby put the head in a right posture. “You cannot use millet seeds or anything similar because millet easily breaks into dust and it has a certain smell that makes the infant sneezing.”
Having learned the rationale of the old science and seen Europeans following the same, Gurung then decided to produce a ‘Nepali baby box’. She initially thought she would also use cardboards to make the bed/box as it is handier than a kokro, a traditional Nepali bamboo crib. “But, as I began exploring, I found several advantages of the kokro,” she explains, “The flooring in Nepali houses is not as fine as it is in other countries. Cardboards are not much sustainable on such floors.”
Therefore, Gurung not only included a kokro in her production list, but she also made it her brand name. [‘Kokroma’ means inside a kokro.]
Empowering women
Gurung says there is another story behind the establishment of Kokroma, besides her summer school experience.
Kokroma employs six tailors, all women, and Gurung claims she pays them a ‘fair wage’.
After attending an all-women filmmaking workshop in 2017, Gurung independently produced a documentary featuring Drichu, a local clothing brand of Bauddha. Building on this experience, Gurung and Finnish filmmaker Gary Wornell applied for a World Bank-assisted project run by the Poverty Alleviation Fund. They were selected and assigned to make documentaries featuring women entrepreneurs from across the country.
“Between December 2017 and February 2018, we travelled from Taplejung to Dailekh and collected stories about Dhaka weaving, Mithila art, hemp clothes and bamboo baskets,” Gurung recalls, “Overall, what these women were doing was impressive, but I was not happy for them because they did not have access to the market. The sustainability of their business was questionable.”
Gurung compared the businesses with Drichu, also led by a woman, and found “it was far successful because it had a market. It was established as a brand.” She then thought about what other enterprises could be appropriate for starting-up women in Nepal. That was the time she remembered the Finnish Baby Box and ordered it.
“Yet, it was clear that I was not going to be an entrepreneur. That was not my cup of tea; I hated maths throughout the school. There was no one in my family from this background,” she says, “I was thinking it for Nepali women in general.” But the ‘shock’ [discussed above] brought her here.
Because the initial idea was empowering women, Gurung says she has been keeping it at the centre. “During my research, I found that many prisoners, including many women, are involved in weaving cotton, but they did not have sufficient market. Hence, I approached the Central Jail in Kathmandu for cooperation and we have become a market for them till today.”
Kokroma employs six tailors, all women, and Gurung claims she pays them a ‘fair wage’.
‘Not a bed of roses’
While Gurung believes in a fair pay policy, it seems her products sold well from day one. “Nope, they didn’t,” Gurung laughs before immediately wearing a  sad mask on her face, “The first days were as frustrating as hell. By December 2018, we made 20 sets but no one purchased it. Then I approached my relatives.”
“One afternoon in February this year, I went to a relative with my set. She didn’t like it. I got disappointed.” Gurung went to a coffee shop in Bauddha “just to cool down.” She had the rejected apparel set in her hand.
“At the cafe, beside me appeared a foreign lady who asked me what I was carrying. I explained it to her. She listened to me carefully and gave me her email address, suggesting I could write to her if I would ever need any financial support for the project,” the woman recalls, “I didn’t believe. A five-minute meeting cannot lead you to any fund. Nevertheless, I wrote to her.”
The Kokroma team frequently has fun during work, claims Gurung.
After a few days, she got the response, a commitment to provide USD 15,000 as a grant in different instalments. Cristina Henriquez from the US has provided her USD 6,000 so far. Gurung hired her first staff and purchased seven secondhand sewing machines with Henriquez’ support. So far, in total, Gurung has spent around two million (USD 20,000 approximately) in the business.
In the meantime, Wornell, the Finnish filmmaker, helped her promote the products in the international market. He also designed the brand’s website and other publicity materials. Today, Gurung considers Wornell her mentor and an integral part of the team. The sexagenarian is living in Nepal for the next two years to study Nepali language, and she hopes to ‘exploit’ his expertise during this period for Kokroma’s promotion.
After passing through depressing days, Kokroma has just been a self-sustaining business, Gurung claims, adding her monthly revenue is Rs 200,000 whereas monthly expense amounts to around Rs 100,000 these days.
“But, there are still many challenges for startups,” Gurung says adding Nepali customers think that made-in-Nepal products should be cheaper than the imported ones irrespective of the quality.  “The customers do not recognise and respect local brands and we want to change it.”
Photos: Courtesy Gary Wornell",/lifestyle,"Sun, 29 Dec 2019 04:51:43 +0000"
31,https://english.onlinekhabar.com/this-72-year-old-rides-his-bike-nine-hours-a-day-because-he-loves-working.html,"Mangal Man Maharjan ferries passengers on his motorbike, around nine hours every day.
Call Mangal Man Maharjan and he will ask ‘where are you?’ before you tell him who you are and why you are calling.
Like hundreds of motorcyclists working for ride-sharing apps Tootle and Pathao in Nepal, Maharjan is accustomed to asking your location every time you call. But, he is strikingly different from most of the riders.
Seventy-two is past the retirement age for most Nepalis, but septuagenarian Maharjan works nine hours every day.
However, he does not have any compulsion to earn living for his family; his children are all grown up and they have been supporting him.
So why does this man ride to ferry people from here to there every day?
The youthful old man
Maharjan looks too old to be a ‘professional’ biker–his hairs are grey and he has already lost many of his teeth. Yet, he tries to show himself ‘young’ to suit the profession: he regularly colours his hair. More importantly, perhaps, an inner zeal makes his face glow.
It was not his hair colour or wrinkled face that posed challenges to his decision to join the job. But, his unfamiliarity with smartphones certainly became an issue. Initially, he feared that he could not do it.
Mangal Man Maharjan learned to use a smartphone from his grandson.
“I even did not know how to answer a call on such phones,” Maharjan says opening Pathao app on his cell, “But my grandson helped me.”
Chronic traffic jams are another challenge for him, but Maharjan has already learned not to lose patience. Whenever he is caught in congestion, he explores if there are alternative routes.
The alley that leads to Maharjan’s house in Ghattekulo of Kathmandu is quite narrow, so he is used to passing through confined paths.
The alley that leads to Maharjan’s house in Ghattekulo of Kathmandu is quite narrow.
Further, it is his experience that has helped him get ready for the job. He worked as a driver for the entire youth of his life. In the first 17 years, he drove trucks. Then, he worked as a night bus driver on different routes.
While driving the bus, Maharjan once got an opportunity to work as a chauffeur for a chief justice of the Supreme Court. That was not a permanent job but Maharjan was content with it because he thought being the chief justice’s chauffeur was more respectful than being a truck driver. “But, the wife of my boss began nagging me as if she was paying for me. That made me quit,” he remembers.
Following that, Maharjan bought a taxi and began driving it. For whatever reason, he gave up that also after three years. He joined a paint shop as a driver again.
One day, he was caught by a traffic police staffer for a minor road discipline issue. He was fined Rs 500. When he asked the employer to give him the money, the employer said, “I won’t pay the next time.”

Maharjan felt that the employer’s statement hurt his dignity and instantly replied, “Okay sir, I will not drive your vehicle the next day.”
He briefly worked for a doctor but left again after realising that his employer was not happy with him.
So why riding again?
“When I left my last job, I slept at home for three days–because I had nothing to do. But, I was restless on the fourth day; I felt my body ached. The longer you sleep, the more your body hurts,” Maharjan says he was tired of passivity.
From the next day, he began spending the entire afternoon with his pet bird, a nightingale. He was happy with it, but he was not satisfied.
Mangal Man Maharjan with his pet bird, a nightingale.
Around the same time, he learned about Pathao.
A few days later, he shared with his family, “I want to register myself as a Pathao rider.” There are four other members in his family: a son, two daughters-in-law and a grandson. His wife died 12 years ago whereas the elder son is in Dubai for work.
“I thought the rider’s job would give me some money whereas I can kill my time easily. Then, you would get a sound sleep. No tension!” It has been around five months since he joined the job.
Maharjan’s daily routine changed since then. He wakes up at 4, takes his favourite breakfast of suji haluwa (a semolina dish), eggs and tea. Then he feeds the pet bird before leaving for the job at around 7. Maharjan does not have anyone to order him how long he should work every day, but he usually takes the last passenger before 4 in the afternoon.

“How old are you?” is the most frequently asked question for Maharjan these days. Some of the ride-sharers tell stories about elderly members of their families. “My dad is also of your age, but he is hospitalised now… my dad cannot walk well, but you drive perfectly… Some of them take selfies with me. They love me, respect me,” he smiles.
“My family also doesn’t like me working,” he says, “They tell me, ‘no more work, stay at home’. But, I love working. I will continue working as long as I can.”",/lifestyle,"Sun, 22 Dec 2019 04:16:17 +0000"
32,https://english.onlinekhabar.com/a-favourite-nepali-hard-cheese-finds-favour-with-canines.html,"Chhurpis hung up for sale in a shop in the Ilam District of eastern Nepal. Photo by Sanjib Chaudhary. Used with permission.
As you pass by the misty Kanyam tea gardens in the Ilam District of eastern Nepal, you will come across bunches of hard cheese hanging in most of the shops.
The hard cheese, known locally as chhurpi, is made from milk collected from naks (female yaks), cows and chauris (a cross between yaks and local hill cows). An excellent source of protein, people throughout the Himalayan region, including Tibet, Darjeeling and Sikkim, and Bhutan, love this hard-to-chew cheese.
However, chhurpi is now a favoured food for dogs in the United States and Europe:

Yeti Dog Chew is an all natural and delicious dog chew made with the goodness of Himalayan yak milk.These are a perfect option to keep your dog happy and busy for longer hours in a safe & natural way.Check out our website to see different sizes of chews available for your dogs  pic.twitter.com/RvVy2pffZl
— Yeti Dog Chew (@YetiDogChew) August 16, 2019

According to the Nepal government’s Trade and Export Promotion Centre, in the fiscal year 2017/18, the country exported more than 800 million Nepalese Rupees (US $7 million) worth of chhurpi. According to local businessmen, about 60-70 percent of the chhurpi exported as dog chew to the United States and Europe is produced in the Ilam district itself.
People love to chew chhurpis cut into small pieces. Photo by Sanjib Chaudhary. Used with permission.
Most cheese varieties tend to be soft, how do they harden this cheese? After collection, the milk is boiled and the fat removed. They then separate the solids from the milk, wrap them in a jute bag to squeeze out the water from the chhurpi, and dry it by putting it out in the sun or by hanging it over a fire.
Godawari International Private Limited, which exports chhurpi as dog chew to India, Japan, Taiwan, Canada, and the United States, explains its rigorous manufacturing process:
[…] Once the milk has cooled down, it is treated with 10 ml of lime juice and 10 mg salt for about 100 gallons of milk. The sour of the mild acid coagulates the milk and the salt speeds up the process. The solids are then separated using a burlap sac [sic], which is washed several times using warm water to remove the whey, and any hints of salt and lime juice.
The solids in the burlap sack are then subjected to squeezing for about 3 weeks when the cake obtained contains at most 5% moisture. The cakes are pressed using weights to remove the excess moisture.
The cake is then cut to size and prepared for cooking [sic] under the sun and smoke[d] for 2-3 months. […]
Two chauris resting at a highland meadow in Nepal. Chhurpi is made from the milk from yaks, cows and chauris. Photo by Sanjib Chaudhary. Used with permission.
The idea to market chhurpis as dog food came from brothers Suman and Sujan Shrestha who, together with Nishes Shrestha, started the company Himalayan Dog Chew in 2003. The idea was sparked when one of the brothers noticed a dog gnawing at a chhurpi. In 2007, they launched their product at a pet fair in Bellingham, Washington. Since then, the company has come a long way: it is currently the largest exporter of Himalayan cheese out of Nepal, employing more than 9,000 people. In 2015, these three Nepali entrepreneurs appeared on the popular American TV show Shark Tank, even though they were already making over US $5 million in sales a year.
Many other companies have since followed their lead, but Himalayan Dog Chew has now diversified, evolving from a single product-oriented business into a full pet supply company. According to its website, the company now proudly partners with a third-generation dairy farm in Washington State, which produces 10 million pounds of milk per month and over 124 million pounds per year, all for Himalayan Pet Supply.
Since this hard cheese is being exported to so many countries, including Canada, Germany, Hong Kong, India, Israel, Japan, Korea, Malaysia, Russia, Singapore, Taiwan, Thailand, United Arab Emirates, the United Kingdom and the United States, its manufacture has become a regular source of income for Nepal’s rural farmers.
To stay afloat in the market, however, manufacturers and exporters need to make sure they keep re-engineering and diversifying the product:

My little bean is losing a few teeth, partially because of @himalayanpet’s yak milk chew. Devastated that I gave her something that broke her teeth & caused her so much pain. So be aware that these chews are problematic at best and potentially dangerous, esp. for older dogs. pic.twitter.com/qlZ7e7F2hX
— Meg McMuffin  (@siamesemeg) October 23, 2018

As per the company’s advisory, the chews might cause choking, indigestion, blockage and breakage of teeth and so advise constant supervision of dogs during consumption.
The article first appeared on Global Voices. View the original post.",/lifestyle,"Fri, 13 Dec 2019 06:27:16 +0000"
33,https://english.onlinekhabar.com/towards-digital-nepal-enabling-citizen-scientists-of-remote-districts-to-map-their-location.html,"
It is quite unusual for villagers of remote Bajura district as they see 18 people from diverse backgrounds, from youth to senior citizens, busy collecting the field data using the GPS (global positioning system) and smartphones.
But recently, the locals of Budhiganga municipality of the district got trained recently to digitally map their resources, landmarks and upload them on the global open platforms called OpenStreetMap. OpenStreetMap is a global initiative to create a complete map contributed by the volunteers which are freely available for everyone to use in the future.
“We wish to create a task force who are readily available to map their own area whenever needed, we are confident that this will contribute to addressing the data gaps and will be crucial in the context of new federal structure,” says Uttam Pudasaini, a leader of the team who trained locals in Bajhang and Bajura districts.
Confident locals
Participants showed great enthusiasm to map their areas as the results were visible instantly online. The experts’ team had remotely mapped whole areas of Bajhang and Bajura beforehand. Some information from the remote map about two municipalities was validated by the participants who collected the field-based data. A total of 41 locals from the two districts participated in the training and made contributions to the validation.

Mira Kumari Joshi, an information technology officer in Khaptad Chhededaha rural municipality, was one of these participants. She says, “We face many difficulties due to unavailability of the digital information about our region and now we are confident that we will be able to map our own area and use this to fulfil our own needs.”
Likewise, Khadak Singh Bista, a local school principal, says, “These kinds of technical skills need to be transferred to the local communities, which could greatly contribute to supporting local level developmental efforts”.
Support for development planning
With the new federal structure in place, the local units seem to be suffering from data deficiency and they have to start it over from level zero. Most of the municipalities are still in the process of producing their municipality profile. Most importantly, if someone wishes to visit the municipality and ward offices from outside, their location is not available online. The only way is to ask local people about the location and rely on them, which sometimes might not be accurate.

During the fieldwork in Bajhang and Bajura, this team found out that even the government authorities like ward offices were not digitally mapped and it was very difficult to find the location for outsiders and even for the community people.
Hence, Deepak Shah, mayor of the Budhiganga municipality, states, “These kinds of information are important in making the development plans and also tracking the road development in the area”.
Information for resilience
Bajura is considered to be one of the most disaster-prone districts of the country. It is impacted by a diverse range of disasters. The situation is exacerbated by the impacts of global environmental changes. In this context, location-based information can play an important role during emergencies in this age of technology.

In cases of humanitarian emergencies, this information will be crucial as the information about key services including health posts, financial services, first aid, and the security forces are available online, for free. Also, if any humanitarian actors wish to use this information for planning any activities, these data can be very helpful.  The community-mapped open spaces can also be used for evacuation, safe shelters and spots for landing helicopters during emergency situations.
On September 16, 2019, the Sanphe-Martadi road section at Balde of Budhiganga municipality in Bajura was blocked due to a massive landslide. There were many other active landslides in the districts, not mapped and located. With this mapping effort, some of the major landslides have been mapped and are available online. Most importantly, local people have been empowered to fill the data gap in the future.",/lifestyle,"Thu, 05 Dec 2019 04:44:47 +0000"
