,url,content,category,published_date
41,https://english.onlinekhabar.com/arrest-warrant-issued-against-nepali-congress-lawmaker-abhishek-pratap-shah.html,"
Butwal, January 3
The Kapilvastu district court has issued an arrest warrant against a Nepali Congress member of parliament after a rival political leader filed a complaint that the NC leader issued a death threat against him.
MP Abishek Pratap Shah of Kapilvastu-3 allegedly issued a threat against RPP central committee member Shaym Kumar Mishra, who filed a police complaint against Shah, a member of the lower house of the federal parliament.
“The court has issued an arrest warrant, but according to the information we have, he is in India,” said district police spokesperson DSP Sunil Malla. “We will now investigate the case,” he added. Mishra claims that Shah thrashed him in his guest room on December 21 after forcing him to take consume sedative drugs. During the incident, MP Shah allegedly pointed a gun at Mishra threatening to kill him. He says that Shah forced the barrel of his gun into his mouth and his teeth hurt following the incident.
Mishra, an RPP candidate for the post of mayor of Krishannagar, has now returned home after receiving treatment in Butwal.",/political,"Fri, 03 Jan 2020 10:32:27 +0000"
42,https://english.onlinekhabar.com/gautam-declines-national-assembly-membership-after-oli-dahal-refuse-to-budge-on-constitution-amendment.html,"
Kathmandu, January 3
Nepal Communist party vice-chair and former minister Bamdev Gautam declined the party leadership’s offer to secure him a seat in the National Assembly after the party chairs refused to table a motion to amend the constitution, it has been revealed.
Earlier in the day, the NCP secretariat made public its list of candidates for the January 23 elections leaving out Gautam and finance minister Yubraj Khatiwada–two names expected to make it to the list.
Gautam, who has been pressing the leadership for a seat in the House of Representatives, declined party chiefs Oli and Dahal’s offer to take a seat in the upper house after the duo refused to amend the constitution to make it possible for a member of the upper house to be named Prime Minister, sources told Onlinekhabar.
According to sources, Gautam’s name was initially on the list of candidates for the upcoming National Assembly elections. However, Gautam put forward a precondition for his candidacy–the constitution be amended to allow an upper house member to take charge as prime minister.
“Comrade Prachanda had told Oli he wanted to discuss Gautam’s candidacy with him. But Oli told Prachanda that there was nothing to discuss and Gautam had to be named a candidate,” an NCP leader said. “But Gautam said that he would go to the national assembly only when the house can elect the prime minister,” the source added.
Both Oli and Dahal dismissed Gautam’s precondition saying that the time was not right for the amendment as Gautam was not going to win the premiership in the near future. Meanwhile, another senior leader Narayan Kaji Shrestha accepted the nomination saying he did not have any aspirations and would agree to whatever the party decides for him.
",/political,"Fri, 03 Jan 2020 10:06:56 +0000"
43,https://english.onlinekhabar.com/will-compel-deuba-to-correct-unilateral-decision-prakash-man-singh.html,"File: Prakash Man Singh
Kathmandu, December 31
An influential Nepali Congress leader, Prakash Man Singh, has said the Ram Chandra Paudel-led faction is determined to continue its struggle against the party president Sher Bahadur Deuba’s unilateral manner.
The faction is angry with Deuba as he endorsed a proposal about fixing the dates for the party’s 14th general convention from the central working committee with majority votes. Putting forth various demands, leaders of the rival camp including Paudel, Singh, Shashanka Koirala, Shekhar Koirala and Krishna Prasad Sitaula had boycotted the meeting.
Speaking with journalists at his residence in Kathmandu on Tuesday, Singh said they would continue boycotting the meeting unless Deuba corrected the decision. “We will see if the majority can do everything,” he said, “We will not go to the central committee meeting, we will not cooperate and we will force them to correct the decision through political and democratic means.”
He also expressed that the rival camp should prepare a strong team to fight against Deuba.",/political,"Tue, 31 Dec 2019 09:19:42 +0000"
44,https://english.onlinekhabar.com/house-panel-endorses-controversial-it-bill-despite-oppositions-protest.html,"A meeting of the Development and Technology Committee in Parliament
Kathmandu, December 29
The Development and Technology Committee in the House of Representatives endorsed the controversial Information Technology Bill with majority votes on Sunday.
Whereas lawmakers of the ruling Nepal Communist Party voted for the bill’s endorsement to forward it to the full House, members of the main opposition Nepali Congress protested. They had demanded that the committee hold a discussion with stakeholders including the media.
Before the bill was put to vote, opposition lawmaker Bahadur Singh Lama had handed over a note of dissent to the committee chair Kalyani Khadka, arguing the bill had provisions against sentiments of the constitution including fundamental rights and civil liberty. During the voting, lawmakers Lama, Rangamati Shahi and Ram Bahadur Shrestha protested.
Now, the bill will be tabled in the House of Representatives for further discussions.",/political,"Sun, 29 Dec 2019 08:45:58 +0000"
45,https://english.onlinekhabar.com/ncp-for-naming-province-3-as-bagmati-retaining-hetaunda-as-capital.html,"Nepal Communist Party office in Dhumbarahi
Kathmandu, December 29
The Nepal Communist Party, which commands a two-thirds majority in the legislature of Province 3, has directed its provincial committee and lawmakers of the province to propose Bagmati as the new name of the province.
The decision has already been communicated to provincial officials, confirms a minister of Province 3 government.
After this decision of the party secretariat today, the Provincial Assembly is certain to adopt the new name because two-thirds lawmakers can change the name. Likewise, the meeting directed for retaining Hetuanda city of Makawanpur district as the capital.
The province, which also includes Kathmandu, was unable to get a name owing to differences in the biggest party. The lawmakers were divided among Newa Mandal, Newa Tamsaling and Bagmati. Likewise, Hetaunda, Bhaktapur and Kavre were being discussed as the capital.
Therefore, the province’s chief minister Dor Mani Paudel had requested the party leadership to decide them.
‘No decision on speaker’s poll, MCC’
Meanwhile, the secretariat meeting could not make any decision about who will be the party’s candidate in the speaker’s election and whether to endorse the agreement on the United States’ government’s Millennium Challenge Corporation grant.
 ",/political,"Sun, 29 Dec 2019 06:29:08 +0000"
46,https://english.onlinekhabar.com/lawmakers-vacationing-as-sudurpaschim-provincial-assembly-falls-short-of-business.html,"File: Sudurpaschim Provincial Assembly
Dhangadhi, December 29
Provincial lawmakers of Sudurpaschim are on a long vacation as the provincial legislature is yet to commence a new winter session for the want of sufficient business.
Some lawmakers are busy with formal events like seminars and training whereas some are visiting other provinces. Likewise, other lawmakers are meeting their cadres in respective constituencies.
It has been four-and-a-half months since the last assembly closed the last session. In the gap since then, the provincial government has not registered any bill for discussion during the next session. That is why the government has not taken any initiative to convene the meeting.
The constitution requires the provincial assembly to begin the next session within six months since the end of the previous session. “But we will not let the gap go that long,” the ruling Nepal Communist Party’s chief whip Tara Lama Tamang says, “We are discussing the issue with the government.”
Provincial speaker Arjun Bahadur Thapa says the new session will be summoned by mid-January. He informs that he will urge the chief minister Trilochan Bhatta to summon the session at the earliest once the government leader will come back to the province from Kathmandu.
He claims that the government failed to register any bill despite his repeated calls to provide business. “I hope a few bills will be registered in the next days,” Thapa maintains.",/political,"Sun, 29 Dec 2019 05:28:56 +0000"
47,https://english.onlinekhabar.com/house-meeting-postponed-after-ncps-failure-to-pick-speakers-candidate.html,"Deputy Speaker Shiva Maya Tumbahamphe chairs a House meeting.
Kathmandu, December 27
The Federal Parliament Secretariat has postponed the meeting called for Friday afternoon till Wednesday next week, January 1, 2020.
The secretariat’s notice says the meeting “could not take place due to special reasons,” but it is apparent that the ruling Nepal Communist Party’s failure to pick its candidate for the speaker’s election resulted in the deferral.
Earlier last week, the secretariat had decided to begin the election process today.
The ruling party is divided on who should be the party’s candidate in the election. Prime Minister KP Sharma Oli wants Subas Chandra Nembang whereas executive chairman Pushpa Kamal Dahal is pushing for agreement on Agni Sapkota’s name. Meanwhile, Deputy Speaker Shiva Maya Tumbahamphe has also staked her claim in the position, refusing to resign as requested by the party.
Unless Tumbahamphe resigns, the party cannot field its candidate for the speaker as the constitution has it that the two officials should represent different parties.",/political,"Fri, 27 Dec 2019 07:11:57 +0000"
48,https://english.onlinekhabar.com/no-irregularities-in-gokarna-resort-lease-extension-govt.html,"Deputy Prime Minister Ishwar Pokharel addresses a National Assembly meeting in Kathmandu, on Thursday, December 26, 2019.
Kathmandu, December 26
The government has clarified that it extended the lease term of Gokarna Forest Resort located in the last belonging to Nepal Trust following existing legal provisions.
Speaking at a meeting of the National Assembly in Kathmandu on Thursday, Deputy Prime Minister and Minister for Defence Ishwar Pokharel, also the chair of the trust, said, “The extension was not decided by the Cabinet or a particular leader. It is based on the act made by the House.”
He added that the extension would not hamper national interests. Pokharel was of the view that the rate charged on the land is not low, but it was decided on the basis of ‘fair market value’.
Pokharel shared the government would soon publish a white paper about details of the transaction.
Earlier, lawmakers including those of the ruling Nepal Communist Party had urged the government to clarify the House about the recent controversy.",/political,"Thu, 26 Dec 2019 06:43:32 +0000"
49,https://english.onlinekhabar.com/dahal-adamant-on-his-pick-for-speaker-oli-not-convinced.html,"L-R: KP Sharma Oli and Pushpa Kamal Dahal
Kathmandu, December 26
Two chairpersons of the ruling Nepal Communist Party are divided about the party’s candidate for the speaker’s position and the difference is likely to delay the election of the top official in House of Representatives.
As per the party’s instruction, Deputy Speaker Shiva Maya Tumbahamphe had adjourned the House meeting for this Friday from last week, and it was expected that the meeting would begin the election procedure. However, thanks to the difference between Prime Minister KP Sharma Oli and NCP’s executive chair Pushpa Kamal Dahal, the process is being deferred.
Dahal wants Oli to endorse his nomination for the candidate. He argues that former speaker Krishna Bahadur Mahara also represented the former Maoist party, hence the same side should be given the position. Oli, on the other hand, is pushing for former speaker Subas Chandra Nembang’s reelection claiming Nembang is the only lawmaker who can tactfully face challenges of the parliamentary procedure in the coming days.
Dahal is likely to pick Agni Sapkota if he is given a chance though he has not pronounced any name in the discussion so far.
Meanwhile, the party is holding its secretariat meeting on Friday. Other leaders of the party have put pressure on the two chairs to forge an agreement before the meeting.
 ",/political,"Thu, 26 Dec 2019 06:08:37 +0000"
50,https://english.onlinekhabar.com/samajwadi-party-withdraws-support-extended-to-govt.html,"L-R: Upendra Yadav and Baburam Bhattarai lead the central committee and federal council of the Samajwadi Party Nepal respectively.
Kathmandu, December 25
A day after its two leaders quit their ministerial jobs, the Samajwadi Party, jointly led by Baburam Bhattarai and Upendra Yadav, on Wednesday announced that it withdrew its support extended to the KP Sharma Oli’s government.
With the decision, the current government has lost the support of two-thirds majority lawmakers in the House of Representatives. However, the number of lawmakers from prime minister KP Sharma Oli’s Nepal Communist Party itself is way higher than the simple majority requirement (51% of the House). Hence, the Samajwadi Party’s withdrawal does not have any significant impact on the government’s legality.
A meeting of the party’s executive committee today made a decision to withdraw the support, Bhattarai and Yadav informed during a press meeting this afternoon.
The party said it would make efforts to amend the constitution so as to make it ‘a constitution of all’ as an opposition side.
Yadav and another Minister Mohammad Istiyak Rai had resigned from their positions on Tuesday after Oli did not let Yadav table a proposal about forming a panel to study the need for the constitution amendment.",/political,"Wed, 25 Dec 2019 09:03:52 +0000"
51,https://english.onlinekhabar.com/ppl-defending-champions-crash-out-at-the-group-stage.html,"A match between Pokhara Paltan and Dhangadhi Blues during the Pokhara Premier League, in Pokhara, on Monday, December 23, 2019.,
Pokhara, December 23
Defending champions of Pokhara Premier League, Pokhara Paltan, have crashed out of the second edition of the tournament at the group state. The team just won a match at the stage while losing four others.
In their last match on Monday, Dhangadhi Blues defeated Pokhara Paltan by five wickets. In the first innings, the Paltan won the toss and chose to bat. However, they could only score a total of meagre 79 runs.
For Pokhara, Ashif Sheikh scored 32 runs whereas Binod Bhandari made 12. Other batsmen could not make any double-digit score. On the opponent’s side, Anil Kharel took the highest of three wickets at the cost of 15 runs. Deepak Puniya, Kamal Singh Airee and Sagar Dhakal took two wickets each.
In the second innings, the winners lost five wickets in achieving the 80-run target. Puniya contributed the highest of 25 runs.",/sports,"Mon, 23 Dec 2019 09:44:58 +0000"
52,https://english.onlinekhabar.com/gyanendra-malla-sets-fastest-century-record-in-nepali-cricket.html,"Kathmandu Golden Warriors captain Gyanendra Malla during a match of Pokhara Premier League, in Pokhara, in December 2019.
Kathmandu, December 18
The captain of Nepal’s national cricket team, Gyanendra Malla, has set a record of the fastest century in the domestic cricket history of the country.
Malla, captaining Kathmandu Golden Warriors against Dhangadhi Blues during a Pokhara Premier League match on Wednesday, scored 100 runs in just 37 balls. Besides being the fastest recorded century of the domestic cricket, it is also the first century in this edition of the league.
Malla had scored eight sixes and nine fours. However, he was immediately sent out by Kamal Singh Airee.
In the first innings of the match today, Malla’s team scored a total of 185 runs. They were defeated in the previous two matches.",/sports,"Wed, 18 Dec 2019 07:00:19 +0000"
53,https://english.onlinekhabar.com/nepals-sag-medalists-tour-kathmandu-for-civic-reception.html,"Some gold medalists of Nepal pose for a photo after their performance during the 13th South Asian Games in Kathmandu, on Monday, December 2, 2019.
Kathmandu, December 13
The government is taking gold, silver, bronze medalists of the recently concluded 13th South Asian Games and their coaches on a tour in Kathmandu for a civic reception on Friday.
The National Sports Council says the event will honour the players and their coaches for their contribution to the country’s excellent performance in the recently concluded regional event.
The tour will begin at Dasharath Stadium in Tripureshwar and move towards New Road, Indrachok, Ratna Park, Singhadarbar, Pulchok, Pulchok, Lagankhel, Satdobato, Koteshwar and Sallaghari of Bhaktapur. In Sallaghari, a function will be organised in their honour. After the function, the players will move from Sallaghari to Tripureshwar via Koteshwar and Baneshwar.
The council has called all stakeholders and the public to participate in the event so as to motivate the athletes.
After Nepal achieved the highest number of gold medals in its history in any regional sports event, the government is celebrating the achievement with different programmes. Prime Minister KP Sharma Oli has recently announced a cash prize for the medalists.
Meanwhile, the Metropolitan Traffic Police Division has said the event will not disturb the city’s traffic management, claiming the event will only use a small section of the road.",/sports,"Fri, 13 Dec 2019 05:06:03 +0000"
54,https://english.onlinekhabar.com/after-loss-nepal-womens-football-coach-resigns.html,"Hari Khadka
Kathmandu, December 9
After a 2-o loss to India in the final match of the ongoing South Asian Games, the coach of Nepal’s national women’s football team Hari Khadka has resigned from his position.
The former national football announced his resignation a few minutes after the game was over at the Pokhara Stadium on Monday.
Khadka said he would take responsibility for the team’s loss in the recent four final events and hence resign. Under Khadka’s coaching, the team had played finals of this SAG, 2019 Nadezhda Cup, 2019 Women’s Hero Gold Cup and 2019 SAFF Women’s Championship. However, they were defeated in all of them.
He said Nepal still needed to improve their striking.",/sports,"Mon, 09 Dec 2019 09:36:48 +0000"
55,https://english.onlinekhabar.com/coach-blames-lack-of-exposure-for-nepali-women-cricketers-sag-failure.html,"Jagat Tamata
Kathmandu, December 8
The coach of Nepal national women’s cricket team Jagat Tamata says his players could not win a gold or silver medal in the ongoing South Asian Games in spite of their hard work. He says the players could not excel because of the lack of exposure.
Though the team were looking forward to the gold medal, they ended the journey with the silver medal on Saturday. A day after that, Tamata views, “The players played well, but they lacked exposure.”
He explains in an interview with Onlinekhabar, “Our cricket association was suspended for the past three years and the suspension was lifted just recently.” Tamata, nevertheless, says the event was also an opportunity for the team to groom themselves.
“The women players got an opportunity to play such  a big event, that too with test nations,” he says, “It will be a good experience for us.”
He said the cricket association should take initiatives to provide exposure to the players now onwards.",/sports,"Sun, 08 Dec 2019 09:46:28 +0000"
56,https://english.onlinekhabar.com/sabitra-bhandari-sets-record-of-highest-number-of-goals-in-nepali-womens-football.html,"Sabitra Bhandari
Kathmandu, December 5
Footballer Sabitra Bhandari has set a new record as the Nepali women footballer who has scored the highest number of goals for Nepal in international matches.
As Bhandari scored two goals during the match held under the 13th South Asian Games against the Maldives in Pokhara on Thursday, she left Anu Lama behind. Previously, Lama and Bhandari had scored equal 35 goals each.
Bhandari’s first goal for Nepal was in the SAF Championship in Pakistan in 2014.",/sports,"Thu, 05 Dec 2019 09:58:38 +0000"
57,https://english.onlinekhabar.com/nepal-make-biggest-score-in-their-t20-history-in-sag-match-against-bhutan.html,"File: Gyanendra Malla
Kathmandu, December 5
Nepal’s men cricketers have scored 236 runs in their match against Bhutan during the 13th South Asian Games currently underway in Kathmandu. It is the team’s biggest score in a T20 match ever.
The host team’s captain Gyanendra Malla scored a century in the first innings of the match. To record his first T20 century, Malla scored nine sixes and five fours. Previous to this, Paras Khadka was the only Nepali player who has scored a century in a T20 match. Khadka scored 57 runs in 28 balls today.
In the match today, Bhutan won the toss and invited Nepal to bat. Openers Khadka and Malla were too powerful against the Bhutanese ballers.
Dipendra Singh Airess scored 45 runs not-out whereas Rohit Kumar Paudel was restricted to just six runs.
Initially, it was expected that Nepal could score more than 250 runs, but they could not perform well in the last two overs.
In the second innings, Bhutan scored just 95 runs and the hosts won the match by a wide margin of 141 runs.
Nepal were defeated by Sri Lanka in their first match.",/sports,"Thu, 05 Dec 2019 05:23:02 +0000"
58,https://english.onlinekhabar.com/sag-2019-nepal-continues-to-add-more-gold-medals-to-the-tally.html,"Himal Tamata
Kathmandu, December 3
As of 3:50 pm on Tuesday, Nepal received a total of 22 gold medals in the 13th South Asian Games.
Here is the list of the players who received the gold today.

Bijaya Sinjalu: Wushu (Taolu)
Susmita Tamang: Wushu (Taolu)
Himal Tamata: Duathlon
Navin Rasaili: Karate
Santoshi Shrestha: Athletics (10,000 m race)
Sunita Maharjan: Karate
Kajal Shrestha: Taekwondo

Find the list of Monday’s gold medalists here.
Updated at 3:52 pm
—
Kathmandu, December 3
Nepali athletes have continued earning more medals during the ongoing 13th South Asian Games.
The country had earned 15 gold medals on the second day of the regional event on Monday. Today, as of 11 am, three more gold medals have been added to the list.
Bijaya Sinjali and Susmita Tamang won the top medals in their respective categories of taolu (wushu). Sinjali scored 9.48 to defeat Mohammad Omar of Bangladesh and Mohammad Abdul of Pakistan. Likewise, Tamang scored 9.44 to defeat Sri Lankan and Bangladeshi opponents.
Likewise, Himal Tamata won a gold medal in a duathlon in Pokhara. He defeated Nepal’s Laxman Malla, who received a silver medal.
Meanwhile,  Nepal’s Tanka Karki won a bronze medal in the male 1,500-metre race today.",/sports,"Tue, 03 Dec 2019 05:31:14 +0000"
59,https://english.onlinekhabar.com/south-asian-games-nepals-gold-tally-reaches-five.html,"
Update 18:00
The gold medal tally for Nepal has reached 15.
Kathmandu, December 2
Nepali athletes have won 10 gold medals in the South Asian Games being played in Kathmandu and Pokhara.
Here’s the list:

Mandekaji Shrestha: Karate (Male individual kata)
Men’s team: Karate
Women’s team: Karate
Soni Gurung: Triathlon
Kamal Shrestha: Taekwondo (Poomsae)
Sima Maden: Taekwondo (Poomsae: 18-23 year-old category)
Parvati Gurung: Taekwondo (Poomsae: 23-29 year-old category)
Laxman Tamang: Karate (Kumite)
Aayasha Shakya: Taekwondo (Poomsae)
Biplav Man Shrestha: Karate (Male kumite)

Updated at 4:30 pm
—
South Asian Games: Nepal’s gold tally reaches five
Kathmandu, December 2
Nepali athletes have won five gold medals in the ongoing 13th South Asian Games being played in Kathmandu.
Nepal’s Sina Maden won the fifth gold for her country in taekwondo (Poomsae) in the 18-23 year-old category. Earlier in the day, Nepal’s men’s and women’s team won gold in their respective karate team events. Similarly, Mandy Kaji Shrestha won the first gold for Nepal in the men’s kata category. The other gold was won by Soni Gurung in triathlon.
During the 12th South Asian Games held in India, Nepali athletes could only win three gold medals. The government had provided Rs 500,000 to each of the gold medal winners in 2016. However, it has not made such an announcement this time.",/sports,"Mon, 02 Dec 2019 07:55:58 +0000"
