url,content,category,published_date
http://telegraphnepal.com/nepal-to-facilitate-india-pakistan-dialogue/,"N. P. Upadhyaya, Kathmandu: The India tilted Nepal has offered its mediatory role in ending the seven decades long conflict in between the two neighboring arch rivals-India and Pakistan.
What could be a nice joke than this?
To recall, India and Pakistan behave with each other as enemies of the highest order since the very second day of the partition, 1947.
It is in this light that Nepal, a close ally and almost a protectorate of the Indian establishment ( this is what the general population believe in Kathmandu who even conclude that the present republican order was a gift from the friend across the border in 2005-6), the Nepali offer of mediation be looked upon.
Pakistan is in knowledge how India has been mercilessly twisting the arms and how Nepal is being micro-managed by the Indian Ambassadors posted in Nepal.




(adsbygoogle = window.adsbygoogle || []).push({});

Most of the time, it is the Indian intelligence agency-the RAW which directly pokes its nose into the affairs of the Nepalese politics.
The Indian mindset is that since the present day order is a sure shot gift from the country across the border which is what allows the “fake traditional friend” to impose its dictates through its paid agents in Nepal.
To put it modestly, it is India and India alone which would never allow Nepal to emerge as a prosperous nation.
This is what sensible Nepali observers guarantee.
The surprising part of it all is that how Pakistan easily believed that an India tilted Nepal could mediate in between the two arch rivals?
Pakistan is hoping against hope but yet what is the harm in hoping for the better if it is in the pipeline?
Presumably, Pakistan may have thought that Nepal is still a sovereign and independent nation in the lap of the Himalayas whose once practiced non-aligned foreign policy makes it a nation which could easily convince the two warring rivals to patch up their differences for the larger benefit of the South Asian region.
Unbelievable as it may appear but the fact is that the request to Nepal to mediate the India-Pakistan conflict has come from the sitting Prime Minister of India.
High place sources in Nepal say that Pakistan’s foreign minister Shah Md. Qureshi talked to his Nepali counterpart Pradip Gyawali and urged him to be of some support in ending the overly stretched India-Pak conflict.




(adsbygoogle = window.adsbygoogle || []).push({});

Nepal is ready to “play the role of mediator” and be “instrumental” in bringing India and Pakistan to the table for talks, Nepali government sources said recently but added that “direct talks” were a better solution, writes Devirupa Mitra for the Diplomacy/South Asia, January 25/20120.
“If necessary, we can play the role of mediator, as we are friendly, independent and peace-loving” adds Ms. Devirupa.  In the region, a Nepali high placed source claimed to a select group of Indian media men visiting Kathmandu in the recent days that “we are neutral, impartial and we love truth and facts.”
The fact is that Nepal is not neutral but possesses visible bias for India but yet if Pakistan feels comfortable with Nepal’s mediation-efforts then observers say, “We have nothing to worry”.
However, Nepal at best can advise both the neighbors from the South Asian region to be in direct contact with each other and settle their disputes once and for all.
The other help Nepal can extend to these South Asian warring neighbors is to provide a safe and secured venue in Nepal (preferably Pokhra) and let the two neighbors to express their feelings in a free and frank manner.
Such a meet may bring the two near to enemies together and if that happens then South Asian region will take a sigh of relief.
If Nepal could bring in India and Pakistan together and ease the uncomfortable situation that prevails at the moment in the South Asian region then that would enhance the diplomatic capabilities of this nation.
The approaching Sagarmatha Sambad( the Sagarmatha Dialogue) to be held in Kathmandu in a month or so can be the best venue for both the inimical rivals, India and Pakistan, to initiate their stalled dialogue.
Rumors have it that it could for sure be this Sambad venue in Kathmandu which may being in ear pleasing new for the population of this part of the world.




(adsbygoogle = window.adsbygoogle || []).push({});

Nepal definitely needs peace in the SA region and this is only possible when India and Pakistan meet.
Definitely, Kathmandu could be the best venue in the entire world for initiating peace talks.
Welcome India and Pakistan in Kathmandu.
Nepal is the current Chair of the near to dead SAARC. The next Chair of the SAARC is Pakistan if and when the SAARC Summit is held.
Let’s hope that if the leaders of the two South Asian countries meet in Nepal, then Nepal can convince India to give the SAARC body a new lease of life.
It is this SAARC body whose next Summit can clean the tarnished image of India because the world clearly understands that the SAARC has been forced to die an unnatural death by the fundamentalist Hindutwa government led by Prime Minister Modi.
Telegraph adds: India and Pakistan may resume their unfinished talks in Kathmandu once again in New Delhi this July when Pakistan will be attending the special session of the Sanghai Cooperation Organization (SCO) meet in India.
India and Pakistan will have the third venue in Russia this year itself if they so desire for settling their long standing disputes through talks.




(adsbygoogle = window.adsbygoogle || []).push({});

So the venue for India and Pakistan to resolve their political differences is in Nepal, Russia and India itself.
But is there the willingness in PM Modi and Prime Minister Imran Khan to patch up their political divergences for the good of the entire region? That’s all.
 
 ",/analysis,"Thu, 30 Jan 2020 05:08:32 +0000"
http://telegraphnepal.com/india-is-taken-over-by-extreme-ideology-says-pm-khan/,"N. P. Upadhyaya, Kathmandu: While Nepal Prime Minister KP Sharma Oli was busy in comforting his long time Indian associate PM Modi- the blockade specialist- for securing the blessings of the man across the border to remain seated in the current post then PM Modi as against this favor to PM Oli managed to secure two key posts in Nepal.
The first one is a constitutional post which time permitting could be used for the political benefits of India, as is the practice, and the other is the victory of a person who is being presumed in Kathmandu’s political circuit as to have been groomed by the regime across the border for several decades but secretly.
It was this political man who suddenly emerged in the national politics from “doctored” hibernation after the India sponsored political change took a formal shape in Nepal that eventually damaged the entire social and political fabric of Nepal.
The India sponsored damage continues to shake the nation in all the possible sectors of the society.
Those who supported India for this damage are ruling the nation mercilessly, it is talked.
He then emerged with a big bang and plays now a key role in the national politics from the Maoists quota.
Needless to say, when India is around one doesn’t need enemy. India’s men are in key posts in Nepal.
The India sponsored change facilitated the Indian machinery to take deep roots in Nepal which gave powers to the Indian Ambassadors posted in Nepal to dictate terms and conditions to the Nepali leaders elevated by the Indian regime at time of the great political change of 2005-6.




(adsbygoogle = window.adsbygoogle || []).push({});

India is fortunate that Nepali leaders prefer to obey the Indian dictates, it is widely believed.
Nepal unifier is hated however, Mahatma Gandhi is eulogized.
Mera Bharat Mahan is for some tilted scholars in Nepal.
While we spoke of what Nepal PM was doing in Nepal for pleasing his long time connections across the border then PM Modi iss being grilled by a sizeable section of the Indian society for having brought about a calculated plan to hit the Indian Muslims  in particular.
With an increase in hate crimes against Muslims in India in recent years more so after the advent of Fundamentalist Hindu Indian PM Modi in 2014 , some fear the world’s largest democracy is becoming dangerously intolerant under the Bharatiya Janata Party (BJP), the BBC’s Rajini Vaidyanathan reported as back as on May 16/2019. 
According to Rajni a February 2019 report from Human Rights Watch found that between May 2015 and December 2018, at least 44 people -36 of them were Indian  Muslims-were killed across 12 Indian states 
Around 280 people were injured in more than hundred incidents across twenty states over the same period.
Indian atrocities have increased of late. Ask Film actor Nasiruddin Shah as to how he is feeling to be an Indian in India where he was born. 
Fundamentalist Hindus have begun chasing Mr. Shah so that the latter finally changes his religion. 
It was not for nothing that Imran Khan said of India in Davos that “India is taken over by “extreme ideology”. 
Film actor Shah’s ordeal testifies this Pakistani assumption. 




(adsbygoogle = window.adsbygoogle || []).push({});

Let’s now take a look at Davos World Economic Forum where Pakistan Prime Minister Khan has met President Trump and has almost stolen the Davos show. 
The US President Donald Trump reiterated once again that he was willing to “mediate” in between India and Pakistan over Kashmir’s overly stretched imbroglio.
This the US President said in Davos, Switzerland while talking to the Pakistan Prime Minister Imran Khan on the sidelines of the World Economic Forum.
Look what the US President says to PM Khan, “What’s going on between Pakistan and India, if we can help, we certainly will be willing to. We have been watching it very closely”.
This statement does hint that the US is very much willing to play its due role; however, what comes into the US way is the India’s negative stance that claims that “it was a bilateral affair”.
Analysts in Nepal conclude that the US fully understands that India has done injustice to the people of Kashmir of late more so after August 5, 2019, yet the US for some strategic reasons doesn’t want to annoy India which may obstruct the smooth going of the Indo-Pacific Strategy, IPS, of which India is presumed to have been made the boss of this part of the world by the US.
The fact is that if the US component is taken out then India is just cipher.
The US has associated itself with a wrong and corrupt partner in South Asia, so believe the Nepali academicians.
India is a bad name in South Asia, to be blunt.
To recall, the Indian leadership of the Indira Gandhi era had milked the then USSR and remained ever against the US during the entire Cold War period.
Much in the same manner, say Nepali intellectuals, India was milking the US after the breakup of the then USSR.
Though Pakistan remained ever with the US as an ally, however, for some reasons unknown to the Nepali observers, the US preferred to keep Pakistan, its former ally of the Cold war era, at a comfortable distance for over two decades.
However, with the advent of new leadership in Pakistan, the US appears to be in a mood to embrace Pakistan but the India factor prevents the US in inching closer with its former ally in South Asia.
The US appears also to have realized better late than never that it should not have pushed Pakistan to the wall under Indian influence.




(adsbygoogle = window.adsbygoogle || []).push({});

But yet President Trump is in full knowledge that without the support of Pakistan Prime Minister, peace in Afghanistan shall remain elusive and thus President Trump prefers to keep the Pakistan Prime Minister in good mood.
“Imran Khan is a good friend of mine”, so said the US President while talking to the international media in Davos.
President Trump is likely to visit India this February.
So how India may have taken the US President’s terming PM Khan as a “good friend” is any body’s guess.
The US President listened attentively the Pakistani concerns in Davos which must not have been taken in good taste by the Indian establishment run by the Modi-Doval-Shankar Hindutwa Troika.
Furthermore, the US President also understands that it is only Pakistani leadership which can institutionalize peace in Afghanistan and avert a war between the US and Iran.
President Trump knows that Pakistan is the single country which enjoys cordial ties with Iran and the Saudi Arabia
The Saudis and the Iranians are not in good speaking terms even.
Talking to Ms. Hadley Gamble of the CNBC Television in Davos on January 22, 2020 the Pakistani Prime Minister said that he while meeting the US President advised not to think of war with the Iranian regime as it will create several other “serious problems” for the US in the region.
PM Khan said, “Military power can never bring in a peaceful solution”.
In the course of the interview with the CNBC, PM Khan gave a silent message to the world leaders not to ignore the Kashmiri annexation by the Indian regime for long as it may result an armed conflict between two nuclear neighbors-India and Pakistan.
He said that, “Kashmir is you know, it is far more serious problem than people realize (than) the world realizes”.




(adsbygoogle = window.adsbygoogle || []).push({});

“The people of Kashmir, through a referendum could decide whichever country they wanted to join. Now that the disputed territory has been annexed by India and they, are trying to change the demography of the Kashmir valley which according to the fourth Geneva Convention is a war crime”, PM Khan told Ms. Hadley of the CNBC Television.
Reacting to PM Khan’s comments made on Kashmir in Davos, the Indian spokesperson Mr. Rubbish Kumar said that since it was a bilateral affair and hence third party mediation was just a distant affair.
Look what he said.
“ There is no role for any third party in the Kashmir issue which has to be resolved bilaterally with Pakistan and the onus is on Islamabad to create an environment for engagement”, Rubbish Kumar said.
However, this Kumar doesn’t speak of India’s export of terror in Nepal and other smaller South Asian nations.
In fact while talking with the CNBC Television, January 22/2020 PM Khan appealed the US to mediate on the Kashmir issue directly or through the UN body or for that matter the European parliament.
The annual World Economic Forum  held in Davos provided an excellent opportunity for the Pakistani Prime Minister to present his country’s perspectives on the contemporary world issues including the seize of the Kashmir valley by the Indian administration.
Last but not the least, the Indian absence in Davos gave an excellent opportunity to Pakistan, a fitting and suitable nuclear and political deterrent to India, for clarifying some misconceptions spread against the country by its declared rival-India. That’s all.",/analysis,"Sat, 25 Jan 2020 04:36:26 +0000"
http://telegraphnepal.com/nepal-prachandas-confession-attracts-notice-of-the-hague-tribunal/,"N. P. Upadhyaya, Kathmandu:  The Head quarter of the Nepal Police force and later the Hague Tribunal have now logical reasons to immediately detain Comrade Prachanda for having killed some five thousand innocent lives during the Maoists led People’s War.
Comrade Prachanda alias Pushpa Kamal Dahal while admitting that he have had killed five thousand Nepali lives was not in a drunken state and that his frank “self-admission” allows the Nepali law enforcement agencies now to take him into their custody.
However, Nepal Police so far has preferred silence in this regard. This is meaningful.




(adsbygoogle = window.adsbygoogle || []).push({});

The former Maoists’ leader Comrade Prachanda while making a speech recently in Kathmandu (Maghi festival January 15) in a beaming manner accepted that he was a “killer” and that he only could be held responsible for having murdered five thousand innocent Nepali lives only.
(Rough estimates have it that some eighteen thousand innocent lives were killed during the Maoists insurgency led by Comrade Prachanda. He was residing in NOIDA, Delhi during the time of the deadliest insurgency).
Doesn’t Prachanda’s self admission make it an easy business to the Nepal’s competent law enforcement authorities to apprehend Prachanda immediately and put him behind the bars as per the existing laws of the land?
The question is reasonable and valid thus.
In this regard, Supreme Court lawyer Ananta Raj Luitel quotes Nepal’s constitutional expert Dr. Bhimarjun Acharya in the Republica Daily, January 17/2020 as saying that ” since this kind of public confession also serves as a notice of crime, it needs to be taken up seriously by law enforcement ( agencies)”.
Dr. Acharya further claims that “this is nothing less than a public confession by the chief of the former rebels and so it should be taken as information for initiating a legal action”, continues advocate Luitel who is also an acclaimed constitutional expert.
Dahal publicly announced, says Dr. Acharya, that he was responsible for killing of five thousand individuals during the Maoists’ insurgency from 1996 to 2006, but not for the entire seventeen thousand individuals killed.
This then attracts the attention of the Section 15 of the Police Act, 1955 which gives powers to the Nepal Police to act on such notice as a “notice” of crime and initiate investigations, adds Dr. Acharya, the declared constitutional authority in Nepal.
Dr. Acharya hastens to add and says, “as per this provision, it is the duty of the Police to act on such information in order to prevent future crime as well as maintain the rule of law”.
He then suggests and expects (perhaps) that the Nepal Police “arrests” persons who must be arrested under the existing laws.




(adsbygoogle = window.adsbygoogle || []).push({});

Dr. Acharya thus hints that the Nepal Police should take Prachanda into their custody.
But isn’t Dr. Acharya hoping against hope?
Legal experts, writes Apex Court Lawyer Ananta Raj Luitel, have also taken strong exception to Dahal’s fresh declaration that he would secure the early release of the suspended lawmaker Resham Choudhary from the Jail.
They argue that such a commitment, adds advocate Luitel in his write up in Republica daily, made in public is an open disrespect of the independence of the judiciary and human dignity since Resham Choudhary is in jail as per the verdict of a competent court of Law in connection with the Tikapur massacre.
Dahal’s statement, adds the legal eagle Mr. Luitel who is also versed in Nepal’s Constitutional processes, goes directly against Article 128 of the Constitution, which states that “respecting Court orders is the duty of every individual as well as of the government authorities”.
Not only under domestic law but also international law, Dahal needs to be held responsible for his public statement, continues legal expert Luitel in his Republica write up.
In the mean while, senior advocate Shankar Kumar Shrestha says “Dahal’s confession should attract legal liability”.
Since it is a confession, there is a need to identify the people who were killed by Dahal aka Prachanda and his party and the victim-parties are entitled to justice and compensation”, continues senior advocate Shretha, according to Mr. Luitel from his Republica story published January 17/2020.
The former Attorney general Raman Kumar Shrestha, who is supposedly close to Dahal aka Prachanda, also says  that “such statements bespeak a serious lack of statesmanship”.
However, he refrains from making sharp comments against Prachanda for some mysterious reasons.
Some legal brains in Nepal opine that if Nepal Police or for that matter some other competent Nepali Courts under political influence tend to ignore  Prachanda’s self admission that he is a killer then the International Criminal Court located in the Hague, Netherlands, must look urgently into the issue pending in Nepal.
For the record, the International Criminal Court (ICC or ICCt) is an intergovernmental organization and international Tribunal that sits in the Hague, Netherlands.
The ICC has jurisdiction to prosecute individuals for the International Crimes of Genocide, crimes against Humanity, War crimes, and the crimes of aggression.
It is intended to complement existing national judicial systems and it may therefore exercise its jurisdiction only when certain conditions are met, such as when national courts are unwilling or unable to prosecute criminals or when the United nations Security Council or individual States refer situations to the Court. ( Source: WIKIPEDIA) .
To conclude: Now it should be the Nepal’s vibrant media and civil society to press the national government to detain first the man who admitted in public that he killed some five thousand people and if such a pressure fails to impress upon the government then the civil society or for that matter the media can appeal or even approach the Hague Tribunal to intervene into the matter.
To recall, Lenin Bista, the Child soldier who claims that he was abused during the Maoists insurgency too has now abundant legal and valid reasons to move the Court in the Hague.
Lenin Bista or some interested quarters can now forward the recorded version (The Maghi speech) of Comrade Prachanda for consideration of the Hague Tribunal.




(adsbygoogle = window.adsbygoogle || []).push({});

Prachanda finally has accepted that he is not an innocent person but has killed several thousand innocent lives.
Attention! The domestic Law enforcement agencies and The Hague Tribunal in the Netherland.
But will the domestic security agencies dare to come into action? Not sure.
But yet poor Prachanda has axed himself finally.  So sad. That’s all.
 
 ",/analysis,"Fri, 17 Jan 2020 13:55:15 +0000"
http://telegraphnepal.com/india-pakistan-meet-in-delhi-may-give-peace-a-chance/,"N.P. Upadhyaya, Kathmandu: The Indian Prime Minister Modi is likely to greet his “near to adversary” Pakistani friend, Prime Minister Imran Khan in New Delhi later this year.
Relations between the two South Asian nations have never been cordial since the days of partition, 1947.
However, the special session of the Sanghai Cooperation Organization (SCO) which India is Chairing this year will bring the two declared enemies face to face.




(adsbygoogle = window.adsbygoogle || []).push({});

Diplomatic sources in Delhi claim that Pakistan will be formally invited to attend the SCO event to be organized in India this autumn.
However, Islamabad is awaiting the Delhi invite.
“This year for the first time India is chairing one of the main SCO bodies, the Council of heads of government and Prime Ministers of the Organization’s member States”, said Vladimir Norov-the sitting Secretary General of the Sanghai Cooperation Organization in New Delhi.
Members of the SCO are India, China, Russia, Kazakhstan, Kyrgyzstan, Russia, Pakistan, Tajikistan and Uzbekistan. Notably, India and Pakistan joined the SCO only in 2017.
The Russian federation is hosting the heads of State meet of the SCO this July, sources say.




(adsbygoogle = window.adsbygoogle || []).push({});

If and when Modi and PM Khan meet in Delhi this year, Nepali observers remain confident that the two leaders of the South Asian region, Modi and Khan, will give peace yet another chance and prove themselves that they too wish peace as against war.
However, PM Modi has a tarnished image in the entire South Asian region.
He is taken as a man who has tentatively killed the SAARC body.
By the way, Pakistan and India have already fought three wars in the past and the forceful occupation of the Kashmir valley by the Indian military forces since August 5/2019 may bring the two nations again face to face thus threatening the stability of the South Asian region.
In the meanwhile, a Pakistani Daily, the Nation, also hints that PM Imran Khan may visit Delhi to attend the SCO special session being chaired by India.




(adsbygoogle = window.adsbygoogle || []).push({});

The two warring rivals must understand the gravity of the situation and make efforts aimed at institutionalizing peace in this part of the world. That’s all.
 
 ",/analysis,"Thu, 16 Jan 2020 11:22:12 +0000"
