url,content,category,published_date
http://telegraphnepal.com/indias-muslim-genocide-us-response-inadequate/,"N. P. Upadhyaya, Kathmandu: The US Senator Bob Menendez– representing the Democratic Party, criticized President Donald Trump on Thursday, February 27, 2020 over his response to the deadly riots in Delhi, India, upon the President’s return from a two-day trip to India.
“I urge the Trump administration, and the rest of the world to condemn the violence in Delhi and press the Indian government to protect all persons regard less of their religion”, Senator Menendez added reports.
Leading Democratic Presidential candidate, Bernie Sanders also attacked President Donald Trump for failure on human rights leadership, saying President Trump’s comment that handling the unrest over the citizenship amendment act CAA was up to India was inadequate, reports the Time of India dated February 28/2020.
Bernie Sanders tweeted dated February 26,2020 says, ” Over 200 million Muslims call India home. Widespread anti-Muslim mob violence has killed at least 27 and injured many more. Trump responds by saying, “that’s up to India”. This is a failure of leadership, writes Bernie Sanders, on Human Rights”.
While the US President Trump was on a two day visit to India,  he traveled from Indian Prime Minister Narendra Modi’s home town Ahmedabad, to Agra – an ancient Muslim city which is located in the most intolerant State of Utter Pradesh headed by its Hindu extremist Chief Minister Yogi Aditya Nath and finally, landed in the capital New Delhi – where Muslims were being structurally targeted by Hindu terrorists.
The ongoing attack on the minority Muslim population by the ‘Hindu Supremacists’ reminds of the Sikh genocide that took thousands of Sikh lives in the year 1984. The terribly stricken Sikhs preferred to quit their homeland ‘Punjab’ for good. It is these Sikhs who have been demanding for themselves a separate state called ‘Khalistan’. As of now the then driven Sikhs (to save their lives) have found shelters in “democratic” countries like the United Kingdom, Australia and the USA.




(adsbygoogle = window.adsbygoogle || []).push({});

The US President visited India for two days that came amid the violent protests that have so far seen more than two hundred injured and several deaths.
To the surprise, President Donald Trump – who was expected as a leader of the free world to criticize the Indian establishment, preferred not to utter a single word  criticizing the state led Muslim genocide.




(adsbygoogle = window.adsbygoogle || []).push({});

Priya Gopal, lecturer at Cambridge University talking to media, tweets Pakistan Prime Minister Imran Khan, claims that the ongoing attacks on Muslim can be equated to structured attack carried out by the Nazi  regime in Germany against the Jew Community in 1938.

Priya Gopal, Lecturer at Cambridge Uni likens attack on Muslims, their mosques, homes & businesses in New Delhi to the pogrom of Jews carried out by the Nazis, esp in 1938 – the Kristallnacht (Night of Broken Glass) when Nazis attacked Jews, their synagogues, homes, businesses. pic.twitter.com/DqSgDZhWgq
— Imran Khan (@ImranKhanPTI) February 28, 2020

The Washington Post (Democracy Dies in Darkness) writes, Joanna Slater, Niha Masih and Tania Dutta dated February 25/2020 that “rioters roamed the streets with Iron rods and wooden sticks, demanding to know whether people were Hindus or Muslims.
The Post adds that “Mosques were damaged and shops were set ablaze, sending smoke billowing high into the air.
“People with Gunshot wounds and blunt trauma from hurled stones rushed into a nearby hospital”, the Post further reports.
Notably, it was President Trump’s second day in India and the same evening he was to leave for his home country.
His officials may have, let’s presume it to have been so, briefed the US President Trump on what has been going in India and what remains yet in the store if the world community doesn’t act.
Critics argue that the United States should not hedge its strategic bets with an increasingly authoritarian and chauvinistic Indian government, especially given that the Modi administration is aggressively carrying out Hindu nationalist policies that discriminate against the country’s large Muslim Minority.
This policy is playing out is an increasingly intolerant and violent political and social environment, writes Michael Kugel man for the Foreign Policy (FP) dated February 28/2020.
Kugleman further writes in his FP article that ” this volatile state of affairs was on stark display during Trump’s brief time in New Delhi, when the Capital was shaken by riots for several days. Armed Hindu mobs roamed the streets with impunity and attacked Muslims while the police who in New Delhi report to the national government often stood by doing nothing”.
Kugleman says this in his FP article titled “India’s illiberal Turn Won’t shake its relationship with the United States”.
And it is time to act, say mature Nepali observers.
The Post made a story of Indian violence with the title, ” Worst communal violence in Delhi in decades leaves seventeen dead as Trump visits India”.




(adsbygoogle = window.adsbygoogle || []).push({});

Pakistan’s Response
India’s declared rival Pakistan in the meantime said that “About 200 million Muslims” of India are being targeted and called upon the global community to act”.
Making a timely statement PM Khan however, warned his majority Muslim population by saying that “I want to warn our people that anyone in Pakistan targeting our non-Muslim citizens or their places of worship will be dealt with strictly. Our minorities are equal citizens of this country”.
In a post shared on Twitter, the Premier of Pakistan said:” Today in India we are seeing the Nazi inspired RSS ideology take over a Nuclear Armed State of over a billion people”.
Recalling his last year’s UN address, PM Khan said that he had predicted during his address at the United nations general assembly that “once the genie is out of the bottle, the bloodshed will get worse”.
A report in the Express Tribune with the headlines ” Saffron Mobs Run amok in Delhi; Dozens killed” said, “a Mosque has been set on fire in New Delhi as more than a dozen people have been killed and hundreds injured in clashes between opposing groups of protestors”, the Indian Capital Hospital officials said on Tuesday February 25/2020.
What says Turkey?
In the meanwhile, India on Thursday, February 27, 2020 asked Pakistan’s close ally Turkey, to refrain from commenting on the internal affairs of the country and also cautioned Ankara against encouraging cross border terrorism.
India’s reaction came after Turkish President Recep Tayyip Erdogan Thursday (February 27/2020) criticized the country after communal riots in Delhi left at least 38 people dead.
Turkey is assisting Pakistan unconditionally which has irked Indian establishment.




(adsbygoogle = window.adsbygoogle || []).push({});

President Erdogan while making a speech in Pakistani parliament (joint session) had unequivocally supported the imprisoned Kashmiri population since August 5/2019.
This has annoyed India very much.
Impact on Nepal
Unfortunately, Hindu fundamentalists’ reign supreme in today’s India whose spillover effect may time permitting have a great negative impact upon Nepal where differing religions have been living since centuries as brothers and sisters.
But if India breaks, as predicted by veteran Indian writer Khuswant Singh in his book “The End of India”, its negative impact could also be seen in Nepal and the smaller countries of South Asia.
The Delhi communal violence has alarmed the Nepali regime for multiple reasons and sensible citizens demand that the Government seals Nepal-India border for at least two weeks until the violence in Delhi subsides. The fanatic goons may enter into Nepal to ignite violence of the sort of what was recently witnessed in Delhi.
Surprisingly, the Nepal government which is almost a new protectorate of Indian establishment has so far made no comments on the Communal riots that rocked Delhi early this week.
The government in Nepal fears that any sharp comments made against Delhi’s BJP government may unseat Prime Minister Khadga Prasad Oli from the coveted chair of the Prime Minister.
Because of the porous Nepal-India border, the goons from India may disturb the peace of this Himalayan nation which has so far maintained the record of having lived in complete harmony with all the followers of differing religions, the Muslims included.
The Muslims in Nepal have so far lived cordially with their Hindu brethren. That’s all.",/analysis,"Sat, 29 Feb 2020 03:50:16 +0000"
http://telegraphnepal.com/nepal-suffocating-chinese-high-handedness/,"Niraj Aryal: It all started with a junior official at the Chinese Embassy in Kathmandu asking a senior Nepali journalist to visit the Embassy to collect a bottle of scotch whiskey. This happened during the last Nepali Dashain Festival. Hilarious, isn’t it?
Obviously, the news spread in the social media like a wild fire.
This Whiskey event nonetheless signaled the beginning of a tragic end to friendly support China was getting from the Nepali population in matters related to regional and international affairs.
Though, age old Nepal-China relations in itself is the witness of existing friendly ties between the two countries, but the general public have slowly but surely begun suspecting China’s real intentions in Nepal.
Political awareness among Nepali population is much higher than in China.
Add to this, the uncontrolled activities of incumbent Chinese Ambassador to Nepal, Ms. Hou Yanqi is making matter even worse.
Back to the whiskey event, the ‘senior editor’ is said to have made a direct complaint to the Chinese Ambassador of how he was asked to collect the gift from the Embassy and that such an act was not acceptable to him.




(adsbygoogle = window.adsbygoogle || []).push({});

The media man, reportedly also told Ambassador Yanqi that he was not an embassy guy to come and collect the gift.
This event could have been a wake-up call instead for the Chinese establishment in Kathmandu, not to be so in the days ahead, Chinese high-handedness grew significantly in Nepal’s internal matters.
Keen watchers in Nepal even claim that the Ambassador’s activities are not only acceptable ‘diplomatically’ but in many more ways than one have been damaging cordial ties that exists in between the two countries since ages.
In the days ahead, she brought more troubles. Look what she did next.
Ambassador Yanqi unannounced entered Singh durbar- Nepal government’s secretariat, with a heavy load of Scotch Whiskies to meet with the newly appointed Minister for Employment, Rameshwar Roy Yadav.
Yadav who is made in the same mold of all tainted Nepali politicians readily accepted the gift. This event was not well received in the social media as few photos of the minister receiving alcoholic gifts from China, got leaked.
Ambassador Yanqi might have concluded that Nepalis can simply be bought by few bottles of Whiskey! She is not entirely wrong.
Further to the second whisky event, Chinese penetration in Nepali politics visibly have grown to a dangerous level.
Here goes another Ambassador Yanqi bombshell.
Some senior Nepali editors affiliated with various media groups had to issue a strong worded statement recently criticizing the Chinese Embassy for “threatening” an editor of a daily newspaper for publishing an opinion on China on his newspaper. Yes, threatening!
The opinion piece talks about how China is hiding information on Coronavirus and that is making matter even worse.
The editors made the statement in response to a Chinese Embassy statement which not only criticizes the editor of the Kathmandu Post, Anup Kafle of being biased on China’s related issues but also threatens him for publishing an opinion piece on the spread of Coronavirus.




(adsbygoogle = window.adsbygoogle || []).push({});

In a direct attack on the Kathmandu Post and its the then Editor Anup Kafle for the article ‘China’s secrecy has made coronavirus crisis much worse’, Ambassador Yanqi issuing a vitriolic statement said, “The Kathmandu Post published an article with malicious intention, deliberately smeared the efforts of the Chinese government and people fighting against the new coronavirus pneumonia and even viciously attacked the political system of China. We, hereby express our strong dissatisfaction and firm protest to it.”
In response, the statement issued by senior Nepali editors reads “We respect any individual or organization’s right to express their dissent or refute contents of the press. But, we disagree with the act of accusing the editor, by mentioning his name, and threatening him for publishing an opinion or news.”
The embassy statement reads further, “It is regrettable that Mr. Anup Kaphle, Chief Editor of the Kathmandu Post has always been biased on China-related issues. This time he went as far as disregarding the facts and becoming a parrot of some anti-China forces and, therefore, his ulterior purpose is destined to failure”.
The reality is also that Nepali media is not at all a sacrosanct entity, it is a wide open fact how Nepal’s big media houses have time and again betrayed their own country on matters related to Indian highhandedness in Nepal.
The Nepali media is often blamed for compromising Nepal’s sovereignty in exchange of lucrative advertisement business coming from multinational Indian companies, which is largely controlled by the Indian Embassy in Kathmandu.
However, Chinese blatant attack on Nepali media is the height of undiplomatic expressions coming as it did from the envoy of a longtime friend China.
Moreover, as is the diplomatic practice, the embassy reserved the right to contradict the article with polite and modest words or could have approached the Foreign Ministry with its reservations against the Kathmandu Post. But the Ambassador chose to take a disgustingly wrong path and tried to malign the entire Nepali media. This is simply unacceptable.
Look what a commoner talking to this scribe recently said, “Our own leaders have looted this country but China, who used to act like a good friend of Nepali people is turning out to be a crooked businessman who will not offer help unless it sees a profit here”.




(adsbygoogle = window.adsbygoogle || []).push({});

Sad it is, but this is how the general Nepali perception is changing on China from a good friend to a crooked business man.
For the road, let’s read what Nepal’s top journalists have to say on the fresh Chinese highhandedness.
Reacting to the Chinese Embassy statement, Anup Kafle, now an erstwhile editor in chief of the Kathmandu Post himself said, “What an honor on my last day of work in this country”.
Senior journalist Vijaya Kumar Pandey says, “The tug of war between the Chinese embassy and the Editorial of the KP is not a common issue”.
Similarly, Kanak Mani Dixit, a senior media man said, “Ambassador to Nepal Hou Yanqi has forgotten diplomatic decorum, and also that Nepal remains a democracy.”
Likewise, responding to the statement, Sudheer Sharma, editor in Chief of Kantipur daily said that “reaction of the Chinese embassy is quite objectionable”.
Finally, Ambassador Yanqi must understand a simple fact that though Nepal’s journalists have to face constant threats, acts of persecution and sometime even threat to their lives from believers of extreme ideologies, but they remain undeterred in expressing their views on internal political matters as well as regional and international affairs.




(adsbygoogle = window.adsbygoogle || []).push({});

Be it also known to the Chinese envoy- who hails from an authoritarian society that, in Nepal not just folks in the editorial rooms but, commoners too are equally competent to analyze complicated local, regional and international political matters in an undeterred manner.
Mind it, this is not possible in her home country and in the last decade or so since her Chinese communist brethren in Nepal have made matter eviler, otherwise Nepalis have been born free.
Will Nepal’s majority communist government summon the ambassador from China and ask her not to exceed her “diplomatic limits”? Forget it!",/analysis,"Wed, 26 Feb 2020 03:33:10 +0000"
